Url,Title,Company Name,Type,Location,Description
https://www.jobteaser.com/fr/job-offers/10347835-verallia-france-charge-e-de-mission-controle-de-gestion-alternance,Chargé/e de mission contrôle de gestion - Alternance,Verallia France,Alternance 24 mois ,Courbevoie (France) ,"Chez Verallia, notre raison d’être est de réimaginer le verre pour construire un avenir durable. Avec environ 10 000 collaborateurs et 34 usines verrières dans 12 pays, nous sommes le leader européen et le troisième producteur mondial de l’emballage en verre pour les boissons et les produits alimentaires et offrons des solutions innovantes, personnalisées et respectueuses de l’environnement à plus de 10 000 entreprises dans le monde. En France, La Tour Carpe Diem accueille depuis 2016 les équipes de la holding du groupe Verallia ainsi que les équipes du siège de sa filiale française Verallia France. Plus de 100 salariés des fonctions support ainsi que les fonctions centrales des principales lignes de métiers s’y retrouvent autour de la Direction Générale. En 2023, venez rejoindre l’équipe contrôle de gestion de Verallia France pour un apprentissage de deux ans ! Les mots du manager :« En intégrant l’équipe finance de Verallia vous rencontrerez beaucoup de diversité tant sur les sujets abordés que les interlocuteurs rencontrés. Vous serez immergés dans l’opérationnel et participerez activement à des projets ambitieux dans un environnement stimulant. » En tant qu’Alternant/e chargé de mission contrôle de gestion, au sein d’une équipe de 6 personnes vos missions seront les suivantes : Gestion des standards : données de base articles, gammes et nomenclatures et mise à jour des données dans SAP (création des nouveaux articles, gestion et saisie de données sur SAP) Calcul des coûts de revient des nouveaux produits Réalisation et optimisation des tableaux de bord mensuels Participation aux phases « plan » et « budget » : études ponctuelles spécifiques, consolidation et contrôle des données. Contribuer à la création de certains fichiers pour le budget, préparation du budget. Lors de cette alternance et sous la responsabilité de votre tuteur, vous développerez vos compétences sur l’outil SAP et en contrôle de gestion industriel. Votre profil Vous préparez un diplôme de type Master et vous recherchez une alternance de deux ans avec une spécialisation en finance/contrôle de gestion au rythme 2 ou 3 semaines en entreprise / 1 semaine à l’école. Vous êtes rigoureux(euse) et vous avez une capacité à faire attention aux détails. Vous avez soif d’apprendre, vous appréciez le travail d’équipe. Votre bon relationnel et votre curiosité vous permettront de réussir au mieux dans vos missions. Rejoignez-nous !"
https://www.jobteaser.com/fr/job-offers/10347745-generali-italia-group-customer-experience-value-proposition-internship,Group Customer Experience & Value Proposition - Internship,Generali Italia,Stage 4 à 6 mois ,Milan (Italy) ,"Generali is a multinational player in the global insurance industry, present in more than 50 countries, 61 million of customers, +70000 employees.  Our ambition is to become a Lifetime Partner for our customers, adding value everyday thanks to personalized propositions enriched with services, professional advice from our 150K agents and an effortless and caring customer experience. Generali Group Marketing team leads the Lifetime Partner transformation and works cross functionally through a series of strategic initiatives.  Global Customer Experience & Value Proposition Team is responsible for: Support and steer markets to deliver an excellent customer experience across all touchpoints, to all our customers in each BU. Review and redesign and drive implementation of new key customers experiences Establish Best in Class T-NPS programs leveraging customer insights & feedback to drive actions Engage ad inspire our Global Customer Experience Communities and foster a customer centric culture Drive cross-functional Personalized Value Proposition Development Strengthen customer insights and customer knowledge to inject the voice of the customer in product development process, Improve Go-To-Market impact of Value Added Services   We are an international team, collaborating with all BUs and stakeholders from various functions, all over the world.  Within this unit we are looking for a Customer Experience and Value Proposition Intern.  The intern will participate in the following activities (depending on his/her profile and preference) Development/create: Support development & cascading of strategic programs (for example Value-Added Service Design Program etc.) Training/project: Support delivery of Journey Design Training Program in Markets Research/CX Management: Perform analysis & identify customer satisfaction & customer insights Internal Communication: support Value Proposition & Customer Experience Community engagement   Please provide your CV in English  Our ideal candidate will meet the following requirements:  Must have: Genuine Customer Passion - understand evolving customer needs, expectations, market trends & demand Practical & hands on attitude Proactive, enthusiastic and active participation in activities Very good English skills One working experience/stage completed Good Analytical skills and ability to use excel (at least basic functions) Basic conceptual skills, with the ability to express key messages using power point (at least basic functions) University degree in business administration, economics or marketing   Nice to have Understanding of Value Proposition Design, Product Development, Segmentation, Customer Experience, NPS Good design and creative skills (e.g. photoshop, etc.) Previous background/study in insurance industry   Additional Information Contract Type: Internship"
https://www.jobteaser.com/fr/job-offers/10347744-generali-italia-communication-csr-intern-generali-global-corporate-commercial,Communication & CSR Intern - Generali Global Corporate & Commercial,Generali Italia,Stage 4 à 6 mois ,Milan (Italy) ,"Generali is a major player in the global insurance industry - a strategic and highly important sector for the growth, development and welfare of modern societies.  Over almost 200 years, we have built a multinational group that is present in more than 60 countries, with 470 companies and nearly 80,000 employees. Our group aims to become the standard bearer and industry leader in the European retail insurance market, building on our existing base of 50 million retail clients, out of an overall total of 72 million.  Generali Global Corporate & Commercial is the Generali Group unit that develops P&C business and insurance services for medium and large companies. The unit acts on a global scale and deploys an integrated approach at Group level with a central management team and specialized teams active in individual countries. Through GC&C, Generali aims to become a key world player in the corporate-commercial segment.  The GC&C Communication Intern will be supporting the GC&C Communication & CSR team implementing the Integrated Communication & CSR activities such as: employee communications and events, content development and digital strategy, external events and ad-hoc projects within the GC&C Communication & CSR office.  The GC&C Communication Intern will be collaborating within the GC&C Communication & CSR Office by: supporting in internal communication initiatives, events and activities to promote corporate culture, values and people engagement supporting the implementation of digital content strategy:  - GC&C websites content updates and curation  - GC&C LinkedIn strategy and content curation supporting in the creation of editorial projects and corporate communication materials, guaranteeing consistency and uniqueness of messages and communication styles supporting in other ad-hoc projects such as GC&C Newsroom (intranet portal)   The candidate is a dynamic person, flexible and adaptable with a strong attitude for interpersonal relationships. Ideally, enthusiastic to learn and undertake new challenges.  Must have: University or professional degree/ University student in communications/marketing/advertising /journalism/business administration Excellent English communication and writing skills Proven writing capabilities Comprehensive knowledge of communication and marketing concepts Experience with MS Office: Word, PowerPoint, Excel, Outlook   Nice to have: Previous internship experiences are a plus Previous experience in a multi-cultural and international environment is a plus   Soft skills: Collaborative mindset with strong interpersonal skills Problem solving attitude Precision and strong organizational skills   Generali is proud to be an inclusive employer that considers applicants regardless of gender, gender identity, sexual orientation, ethnicity, disability, religion, political views, marital status or philosophy of life.  If you have a disability or special need that requires accommodation or assistance, we will support you during the selection process.  Additional Information Contract Type: Internship"
https://www.jobteaser.com/fr/job-offers/10347736-elis-responsable-portefeuille-client-h-f,Responsable Portefeuille Client H/F,Elis,CDI ,Aix-les-Bains (France) ,"L'entreprise  Rejoignez Elis, groupe multiservices, leader de la location-entretien de vêtements professionnels, d'articles textiles et d'hygiène. Notre mission : simplifier la vie des professionnels en leur permettant de se concentrer sur leur coeur de métier. Ainsi 400 000 clients, de toute taille et de tout secteur, nous font confiance à travers le monde. Grâce à nos 45 000 collaborateurs portés par leur excellence opérationnelle, nous connaissons une croissance ininterrompue depuis 60 ans. Avec près de 500 centres de production et distribution répartis dans 28 pays, nous bénéficions d'un rayonnement international qui nous permet d'agir au plus près de nos clients.  Le service c'est Elis. Et Elis c'est vous.  Le poste  Rattaché(e) au Responsable de centre, vous prenez en charge un portefeuille de clients existants BTOB et encadrez une équipe de distribution commerciale de 5 personnes. A ce titre : - Vous managez une équipe composée de chauffeurs-livreurs commerciaux et d'un(e) assistant(e) commercial(e) : recrutement, définition des objectifs, mise en place de challenges, formation, accompagnement individualisé, réunions... - Vous accompagnez et fidélisez les clients de votre portefeuille par une présence récurrente sur le terrain. - Vous maintenez et développez le chiffre d'affaires du portefeuille confié. Vous proposez des services supplémentaires, négociez et faites évoluer notre prestation pour la rendre toujours plus adaptée aux besoins de vos clients : vous traitez leurs demandes en y apportant des solutions sur mesure. - Vous êtes l'interface entre vos clients et les différents services de l'entreprise dans un objectif de relation commerciale optimale. - Vous pilotez et analysez les indicateurs d'activité (résultats, ventes additionnelles, taux de satisfaction clients, NPS...) Un parcours d'intégration sera mis en place dès votre arrivée afin de prendre votre poste au mieux (découverte des métiers, visite sur d'autres sites, ""vis ma vie"" avec votre équipe...).  Le profil  De Bac 3 à Bac 5 vous êtes issu d'une formation à dominante commerciale et vous avez acquis une première expérience. Vous êtes une personne de terrain et vous avez le sens du service. Avoir eu une première expérience en management serait un plus. Rémunération fixe + variable + Participation et intéressement. Dans le cadre de vos fonctions, vous bénéficiez d'un véhicule de fonction modèle 4 places."
https://www.jobteaser.com/fr/job-offers/10347729-elis-responsable-de-developpement-commercial-h-f,Responsable de développement Commercial H/F,Elis,CDI ,Aix-les-Bains (France) ,"L'entreprise  Rejoignez Elis, groupe multiservices, leader de la location-entretien de vêtements professionnels, d'articles textiles et d'hygiène. Notre mission : simplifier la vie des professionnels en leur permettant de se concentrer sur leur coeur de métier. Ainsi 400 000 clients, de toute taille et de tout secteur, nous font confiance à travers le monde. Grâce à nos 45 000 collaborateurs portés par leur excellence opérationnelle, nous connaissons une croissance ininterrompue depuis 60 ans. Avec près de 500 centres de production et distribution répartis dans 28 pays, nous bénéficions d'un rayonnement international qui nous permet d'agir au plus près de nos clients.  Le service c'est Elis. Et Elis c'est vous.  Le poste  Rattaché(e) au Responsable de centre, vous prenez en charge un portefeuille de clients existants BTOB et encadrez une équipe de distribution commerciale de 5 personnes. A ce titre : - Vous managez une équipe composée de chauffeurs-livreurs commerciaux et d'un(e) assistant(e) commercial(e) : recrutement, définition des objectifs, mise en place de challenges, formation, accompagnement individualisé, réunions... - Vous accompagnez et fidélisez les clients de votre portefeuille par une présence récurrente sur le terrain. - Vous maintenez et développez le chiffre d'affaires du portefeuille confié. Vous proposez des services supplémentaires, négociez et faites évoluer notre prestation pour la rendre toujours plus adaptée aux besoins de vos clients : vous traitez leurs demandes en y apportant des solutions sur mesure. - Vous êtes l'interface entre vos clients et les différents services de l'entreprise dans un objectif de relation commerciale optimale. - Vous pilotez et analysez les indicateurs d'activité (résultats, ventes additionnelles, taux de satisfaction clients, NPS...) Un parcours d'intégration sera mis en place dès votre arrivée afin de prendre votre poste au mieux (découverte des métiers, visite sur d'autres sites, ""vis ma vie"" avec votre équipe...).  Le profil  De Bac 3 à Bac 5 vous êtes issu d'une formation à dominante commerciale et vous avez acquis une première expérience. Vous êtes une personne de terrain et vous avez le sens du service. Avoir eu une première expérience en management serait un plus. Rémunération fixe + variable + Participation et intéressement. Dans le cadre de vos fonctions, vous bénéficiez d'un véhicule de fonction modèle 4 places."
https://www.jobteaser.com/fr/job-offers/10347714-kpmg-france-auditeur-debutant-auvergne-rhone-alpes-bourgogne-f-h,AUDITEUR DÉBUTANT AUVERGNE RHONE ALPES BOURGOGNE F/H,KPMG France,CDI ,Lyon (France) ,"Comme nos 10 000 collaborateurs, faites le choix d'une société à mission en plein essor, où la contribution de chacun et chacune est encouragée pour grandir ensemble. Faites le choix d'exceller autrement en œuvrant pour une performance durable autant que financière. Faites le choix, chaque jour, d'impacter positivement l'économie, les territoires et la société depuis un de nos 200 bureaux en France. Faites le choix de KPMG. Vous souhaitez intégrer les équipes Audit de KPMG ? Relevez les défis d'une session de recrutement immersive à distance le 7 mars 2023et décrochez votre CDI sous 48 Heures au sein de la Région Auvergne Rhône-Alpes Bourgogne Franche-Comté Au programme: Une présentation du cabinet ponctuée de défis et d'échanges avec nos collaborateurs en digital Deux entretiens individuels par visioconférence La garantie d'une réponse individuelle sous 48h - avec idéalement une offre à la clé ! En rejoignant les équipes audit de la Région Auvergne Rhône-Alpes Bourgogne Franche-Comté vous accompagnerez des entreprises internationales, des groupes familiaux, des PME/PMI et des associations de secteurs d'activité variés. Rejoindre KPMG c'est la garantie d'être au plus près du tissu économique de la région ! En collaboration avec l'équipe, vous serez amené.e à : Travailler au sein d'équipes pluridisciplinaires, pédagogues et reconnues pour leur expertise ; Développer votre compréhension des enjeux et organisations d'entreprises dans des secteurs d'activité variés ; Développer votre capacité d'analyse des données financières et votre esprit critique ; Monter rapidement en responsabilité en ayant un double accompagnement personnalisé RH et technique ; Etre sur le terrain, au plus près des entreprises Et bien sûr vous épanouir au sein de nos équipes ! Diplômé(e) d'un Bac +5 (école de commerce, d'ingénieur ou université), vous justifiez d'une première expérience (stage ou alternance) en finance. Dynamique, entreprenant(e), doté(e) d'un fort esprit d'analyse, vous recherchez une culture d'entreprise où la gestion des compétences est une réalité. Vous vous reconnaissez dans cette description ? … n'hésitez plus, postulez et rencontrons-nous ! Localisation : Des opportunités en CDI à saisir dès septembre 2023 au sein de nos bureaux de la Région Auvergne Rhône-Alpes situés à Annecy, Dijon, Grenoble, Lyon et Saint-Etienne. N'attendez plus, postulez et rejoignez un environnement de travail inclusif où le sens du collectif est clé. Retrouvez des témoignages de participants, devenus collaborateurs KPMG en 48h ! Tous nos postes sont ouverts aux personnes en situation de handicap."
https://www.jobteaser.com/fr/job-offers/10347708-greenshoot-supply-chain-manager-ingenieur-logistique-et-achats-cdi,Supply chain manager - ingénieur logistique et achats CDI,GreenShoot,CDI ,Paris (France) ,"ENTREPRISE GreenShoot est une jeune entreprise française spécialisée dans les soupes au rayons frais. Elle est la marque urbaine emblématique et tendance. Nous sommes une PME ultra dynamique et en pleine expansion, notre mission est d’amener le bon et le beau dans le bol. La créativité est une de nos forces pour réussir sur les différends marchés : GMS, RHF et export. Résolument premium et tournée vers l'excellence de la qualité et du service, Greenshoot incarne auprès de ses clients la promesse d’une expérience culinaire accomplie. Notre super équipe la Green-Team recherche un nouveau coéquipier : son ingenieur supply chain et achats. Notre équipe est animée par des valeurs fortes : l’excellence, l’exigence, le côté pionnier, l’humilité le sens du collectif. MISSIONS Rattaché.e directement à la Direction Générale, vous aurez à assurer la s upervision de l’ensemble de la chaîne logistique et de l’approvisionnement des matières premières jusqu’à la livraison de nos produits sur les entrepôts de nos clients. Vos principales missions consisteront à : Sélectionner les fournisseurs et négocier les contrats d’achat des matières premières Assurer les approvisionnements amont Effectuer la prévision des ventes en tenant compte des facteurs d’influence Établir les plannings de production et l’ordonnancement Gérer les stocks : produits finis, emballages, matières Optimiser le taux de service Réduire les pertes & déstockages PROFIL Ayant déjà eu une expérience en supply chain dans une entreprise idéalement agroalimentaire, vous souhaitez vous accomplir au coeur d'une PME dynamique !  Esprit agile, les chiffres vous parlent et vous savez leur parler ; l’efficacité est votre crédo ! Vous disposez d’une très grande aisance sur Excel et des bases en base de données.  Vous appréciez la rigueur et recherchez sans cesse la rationalisation et la performance. Faisant preuve de qualités relationnelles, vous aimez négocier et savez poser des conditions de manière ferme. Votre personnalité dynamique et entrepreneur aura autant d'importance que vos compétences. Vous êtes dynamique et aimez les défis ? Entrepreneur et motivé par le résultat ? Les chiffres et l’analyse sont vos amis ? L’équipe est une valeur forte chez vous ? Alors n’hésitez plus, vous êtes au bon endroit, rejoignez notre équipe ! De formation Grande école ingénieur ou cursus équivalent spécialisé Supply. INFORMATIONS UTILES Mission basée à Boulogne Billancourt (92). Accès direct en métro ligne 9 et 10. Offre en CDI, rémunération selon profil. Salaire suivant profil et expérience Outils : Mac et Iphone. Mutuelle d’entreprise prise en charge à 100% par Greenshoot. Ticket restaurant Soupes et gaspachos à volonté ;)"
https://www.jobteaser.com/fr/job-offers/10183112-stanwell-consulting-consultant-e-strategie-et-transformation-cdi-paris,Consultant(e) - Stratégie et transformation [CDI] - Paris,Stanwell Consulting,CDI ,Paris (France) ,"Créé en 2006, Stanwell Consulting est un cabinet de conseil en stratégie et transformation, représentant aujourd'hui une équipe de 100 consultants dirigée par 10 associés. Son positionnement original associe vision stratégique des modèles métier et capacité à accompagner des plans de transformation, s’appuyant sur des domaines d’expertise et une capacité à créer des solutions sur-mesure dans les secteurs de la Banque, l'Assurance et la Protection sociale, sur les métiers cœur ainsi que les fonctions transverses des R.H., Finance et Risques, et IT/Innovation. Convaincus que l’innovationet le développement technologique et économique passent par une collaboration efficace entre Grandes Entreprises et Start-ups, Stanwell co-fonde en 2015 l’association ‘Blue Circle’ pour décloisonner ces deux mondes et accompagner leur transformation digitale. 2 ans plus tard, c'est la naissance d'une troisième marque : WedR, pour traiter de l’innovation sur toute la chaine de valeur, de l’idéation à l’implémentation. Actuellement, nous recherchons un-e Consultant-e pour un stage de fin d'études ou un premier CDI chez Stanwell : Élaboration de stratégieset stratégies opérationnelles Amélioration de l’efficacité commerciale (segmentation, innovation, développement d’offres, distribution, tarification) Amélioration de l’efficacité opérationnelle(modèle de service, organisation/centres de services partagés, pilotage par les processus, management de la performance) Accompagnement de la transformation / conduite du changement (conduite opérationnelle du changement, dynamisation de l’organisation et pérennisation du changement) Transformationde fonctions transverses (Finance & Risques, RH, SI) Développement de contenus (pitchs, offres, articles, veille, etc.) People Development(animation de formation, etc.) Afin de développer notre activité, nous recrutons des jeunes consultants issus de grandes écoles françaises telles que H.E.C., ESSEC, E.S.C.P., EM Lyon, EDHEC, Audencia, Polytechnique, Ecoles Centrales, Mines de Paris, Supélec, Sciences Po… mais l’école ne fait pas tout ! Stanwell recherche des personnalitéstrès diverses liées par les mêmes valeurs : dépassement de soi, sens de la relation client, dynamisme et esprit d’équipe. Nos recruteurs ont pour mission de ne recruter que des personnalités qu’ils estiment pouvoir un jour être cooptées Associé. Nous recrutons les consultants dont nos clients ont besoin : des expériences variées, issus de classes préparatoires et d’admissions parallèles, en Grande Ecole ou Master Spécialisé Audit/Conseil, pour des stages de fin d'études ou CDI."
