Url,Title,Company Name,Type,Location,Description
https://www.jobteaser.com/fr/job-offers/10347301-michelin-business-developer-h-f-pays-de-la-loire,Business Developer (H/F) Pays de la Loire,Michelin,CDI ,Béhuard (France) ,"Le Contexte Prenez en main un de nos secteurs de la région Pays de la Loire, et rejoignez une équipe d'environ 8 responsables commerciaux (Business Developers) accompagnés au quotidien par un Responsable des Ventes Régional. Vous avez de bonnes capacités relationnelles et l'envie de vous dépasser ? Vous êtes prêt à vous remettre en question et à monter en compétence dans le cadre d'un parcours ? Alors rejoignez-nous ! La Mission En charge d'un portefeuille clients de 10 à 15 M€, vous aurez la responsabilité de développer les ventes sur un territoire en France. Pour cela, vous imaginerez en collaboration avec vos collègues et votre responsable régional un plan d'action business. Pour remplir cet objectif, vous devrez entre autres : Gérer votre portefeuille de clients existants (Spécialistes du pneumatique, Centres Auto, Concessionnaires …) Vendre les produits et services du groupe Michelin Piloter les opportunités commerciales pour les convertir en ventes. Accompagner le lancement de nouvelles solutions. Supporter l'équipe marketing dans l'analyse de la performance des produits et services. Compétences requises De formation commerciale Bac+3 à Bac+5, vous devez avoir le goût du challenge et de la satisfaction client. Adaptabilité, résilience et remise en cause seront vos meilleurs atouts ! Le travail en équipe et l'intérêt des produits technologiques sont autant de points forts qui favoriseront votre intégration au sein du Groupe. Processus de recrutement Si votre CV est retenu, vous pourrez nous rejoindre après 2 étapes validantes : - Un entretien vidéo - Une journée complète de recrutement, pour pouvoir exprimer pleinement votre personnalité et nous montrer vos compétences. Un moment très apprécié des candidats et des candidates ! Après cette dernière étape, un retour détaillé vous sera fait sous 2 jours Rémunération et avantages Rémunération : de 40 000 € à 55 000 € Véhicule de fonction Intéressement, plan épargne entreprise, plan d'actionnariat, pneus d'essai … Formation continue Intégration et développement Vous intégrerez l'école de vente Michelin pour une durée de 3 mois à Clermont-Ferrand pour maîtriser notre offre produits pneumatiques/services ainsi que notre méthode de vente. Grâce à cette formation, vous prendrez en charge votre secteur sur la région Pays de la Loire dans les meilleures conditions possibles. Et nous vous proposons par la suite un véritable parcours de développement de vos compétences. Nous sommes prêts… et vous ? #LI-EB1 #Vente #Business Developer #Responsable commercial #Account manager #Pays de la Loire"
https://www.jobteaser.com/fr/job-offers/10347287-ey-auditeur-financier-secteur-asset-management-paris-f-h,Auditeur Financier- secteur Asset Management - Paris- F/H,EY,CDI ,Paris (France) ,"Auditeur Financier- secteur Asset Management - Paris- F/H  EY rassemble aujourd'hui 284 000 associés et collaborateurs à travers le monde, dans plus de 152 pays. Grâce à ce réseau, dont le niveau d'intégration et l'ampleur internationale sont gages d'une même excellence partout dans le monde, EY renforce sa position de leader mondial de l'Audit, du Conseil, des Transactions, de la Fiscalité et du Droit. Notre expertise et la qualité de nos services contribuent à créer les conditions de la confiance dans l'économie et les marchés financiers. Nous faisons grandir des leaders afin, qu'ensemble, ils accompagnent les organisations vers une croissance pérenne. Et notre engagement envers nos équipes commence avec cette promesse : quel que soit votre parcours avec nous, l'expérience EY dure toute une vie.  Au sein du département FSO (Financial Services Office), 1 200collaborateurs en France combinent leurs expertises métiers et fonctionnelles, afin de répondre efficacement aux besoins de nos clients en gestion d'actifs, banque ou assurance.  Dans un contexte en perpétuel changement et hautement réglementé, nous apportons ainsi à nos clients des conseils pointus et de haut niveau pour les aider à gérer les incertitudes et les opportunités de ce secteur.  Dans le cadre de notre développement, l'équipe FSO Audit Asset Management recherche des collaborateurs Auditeurs Débutants H/F en CDI à compter de Juillet/septembre 2023.  Vos missions :  Au sein d'une équipe, vous participerez à des missions d'audit et de conseil auprès des principaux acteurs français et internationaux de la gestion d'actifs : • Vous intervenez sur des missions de commissariat aux comptes ou sur des missions financières à forte valeur ajoutée (revue de business plan, revue des contrats à long terme, opérations de transactions…), • Vous mettez en œuvre notre méthodologie d'audit (analyse de l'environnement et de la stratégie de l'entreprise, évaluation des risques, revue du cadre du contrôle interne, audit des états financiers et revue qualitative de l'information financière …) et portez une attention particulière à la communication financière de ces groupes dans plusieurs référentiels (IFRS et US Gaap notamment), • Vous êtes amené(é) à intervenir sur un ensemble de problématiques et d'enjeux financiers afin d'apporter à nos clients et à leurs interlocuteurs (sociétés de gestion et fonds de tous types : OPCVM, fonds alternatifs,…) l'assurance et la fiabilité nécessaires à leur progression.   Profil :  De profil école de commerce option finances/comptabilité ou 3e cycle universitaire en finance de marché, vous parlez anglais, avez le goût du travail en équipe et le sens du contact.  Vous avez également déjà démontré un intérêt pour notre métier au travers de stages que vous avez effectués en cabinet d'audit ou en entreprise dans des services financiers, dans un contexte international.  Vous avez un intérêt certain pour l'industrie de l'Asset Management.  Disponible, autonome, organisé et mobile, vous vous adaptez très rapidement aux changements et aux besoins de nos clients. Vos qualités relationnelles seront des atouts pour réussir dans cette fonction et pour pouvoir évoluer.   Vivez l'expérience EY, rejoignez-nous.  Dans le cadre de sa politique Diversité, EY étudie, à compétences égales, toutes candidatures dont celles de personnes en situation de handicap."
https://www.jobteaser.com/fr/job-offers/10347248-michelin-business-developer-h-f-grand-est,Business Developer (H/F) Grand Est,Michelin,CDI ,Champenoux (France) ,"Le Contexte Prenez en main un de nos secteurs de la région Grand Est, et rejoignez une équipe d'environ 8 responsables commerciaux (Business Developers) accompagnés au quotidien par un Responsable des Ventes Régional. Vous avez de bonnes capacités relationnelles et l'envie de vous dépasser ? Vous êtes prêt à vous remettre en question et à monter en compétence dans le cadre d'un parcours ? Alors rejoignez-nous ! La Mission En charge d'un portefeuille clients de 10 à 15 M€, vous aurez la responsabilité de développer les ventes sur un territoire en France. Pour cela, vous imaginerez en collaboration avec vos collègues et votre responsable régional un plan d'action business. Pour remplir cet objectif, vous devrez entre autres : Gérer votre portefeuille de clients existants (Spécialistes du pneumatique, Centres Auto, Concessionnaires …) Vendre les produits et services du groupe Michelin Piloter les opportunités commerciales pour les convertir en ventes. Accompagner le lancement de nouvelles solutions. Supporter l'équipe marketing dans l'analyse de la performance des produits et services. Compétences requises De formation commerciale Bac+3 à Bac+5, vous devez avoir le goût du challenge et de la satisfaction client. Adaptabilité, résilience et remise en cause seront vos meilleurs atouts ! Le travail en équipe et l'intérêt des produits technologiques sont autant de points forts qui favoriseront votre intégration au sein du Groupe. Processus de recrutement Si votre CV est retenu, vous pourrez nous rejoindre après 2 étapes validantes : - Un entretien vidéo - Une journée complète de recrutement, pour pouvoir exprimer pleinement votre personnalité et nous montrer vos compétences. Un moment très apprécié des candidats et des candidates ! Après cette dernière étape, un retour détaillé vous sera fait sous 2 jours Rémunération et avantages Rémunération : de 40 000 € à 55 000 € Véhicule de fonction Intéressement, plan épargne entreprise, plan d'actionnariat, pneus d'essai … Formation continue Intégration et développement Vous intégrerez l'école de vente Michelin pour une durée de 3 mois à Clermont-Ferrand pour maîtriser notre offre produits pneumatiques/services ainsi que notre méthode de vente. Grâce à cette formation, vous prendrez en charge votre secteur sur la région Grand Est dans les meilleures conditions possibles. Et nous vous proposons par la suite un véritable parcours de développement de vos compétences. Nous sommes prêts… et vous ? #LI-EB1 #Vente #Business Developer #Responsable commercial #Account manager #Grand Est"
https://www.jobteaser.com/fr/job-offers/10347228-carrefour-france-assistant-e-chef-de-projet-f-h-en-stage,Assistant(e) chef de projet (F/H) en Stage,Carrefour France,Stage 4 à 6 mois ,Évry-Courcouronnes (France) ,"Si Carrefour est partenaire de Paris 2024, c'est parce que nous retrouvons beaucoup de nous dans les valeurs du sport ! Nous aimons les challenges et visons une performance durable : Face aux défis de notre époque, Carrefour a pour ambition de rendre le meilleur accessible à tous et de s'affirmer en chef de file d'une distribution responsable. Cela signifie de nombreux projets et occasions d'innover au quotidien pour nos équipes. Nous nous épanouissons en équipe : Métiers du commerce, métiers d'expertise, entrepreneurs unissent leurs compétences et leurs efforts pour construire ensemble une chaîne de valeur au service des consommateurs. Au plus près de nos clients ou en coulisses, chacun a un rôle à jouer mais peut compter sur les autres pour réussir. Nous veillons à ce que chacun puisse aller loin : L'envie et le mérite sont les seuls pré-requis pour nous rejoindre, accéder à une formation, changer de métier, être promu ou créer son entreprise. Nous partageons la victoire : nos collaborateurs sont engagés et nous nous engageons en retour. En offrant des rémunérations et des avantages parmi les meilleurs de notre secteur, en permettant à chacun d'être associé aux résultats, en veillant à la santé de tous.  Porteuse de cette ambition, la Direction Partenariats E-Commerce Groupe recrute un(e) : Assistant(e) chef de projet (F/H) en Stage Les missions  Montée en compétence sur les solutions Uber Eats et Deliveroo (fonctionnellement et techniquement) et accompagner la Senior Manager Solution IT & Projets dans ses différentes missions.  Le périmètre porte principalement sur la France, sur les partenaires Uber et Deliveroo Dans ce cadre, vous serez amené à réaliser :  1/ Suivi général du run - Coordination avec les équipes IT et métier sur les problématiques IT - Synchronisation et communication avec les équipes support et formats - Suivi des actions et relances - Point d'entrée pour les partenaires Uber et Deliveroo  2/ Accompagnement sur les projets de cadrage - Rédaction des CR - Suivi des actions - Relances des acteurs - Contribution à l'élaboration de présentations projets sur Slide Informations complémentaires : Lieu : Massy Durée du contrat : 6 mois ● Comité d'Entreprise généreux pour vos Loisirs, Voyages et Équipements, etc. ● L'accès à des services exclusifs à Massy : salle de sport, crèche, plusieurs options de restauration au sein du siège avec participation CE, infirmerie, téléconsultation médicale, conciergerie, coiffeur, etc. ● Carrefour s'engage pour la santé et le bien-être de ses collaborateurs en leur proposant une solution gratuite pour faire du sport : Gymlib ● Un accès à un large choix de restauration (dont Paul et Starbucks au sein du campus) Chez Carrefour, nous avons à cœur de ne passer à côté d'aucun talent et sommes fiers de compter des équipes représentatives de la société dans son ensemble. Nous encourageons ainsi tous types de profils à postuler à cette offre et garantissons un processus de recrutement dénué de toutes formes de discriminations. Votre profil :  Le candidat suit une formation dans la gestion projet / l'informatique (IUT, BTS).  - Francais et anglais courant obligatoire, langues de travail quotidiennes - Esprit d'analyse et synthèse - Autonomie et capacité d'initiative - Capacité de vulgarisation (adaptation du discours en fonction de son audience parfois très technique parfois néophyte) - Bonne compréhension générale de la technologie et des concepts suivants : - Solution SaaS - Patterns d'intégration de type API / Messages / Fichiers (un plus) - Applications mobiles - Bonne connaissance de google sheet et Slide  Idéalement : - Première expérience dans le e-Commerce alimentaire. - Première expérience dans la gestion de projet - Client quick commerce (Uber, Deliveroo, Gorillaz etc.)"
https://www.jobteaser.com/fr/job-offers/10347220-ey-auditeur-financier-secteur-banque-assurance-paris-f-h,Auditeur Financier secteur Banque Assurance - Paris F/H -,EY,CDI ,Paris (France) ,"Auditeur Financier secteur Banque Assurance - Paris F/H  EY rassemble aujourd'hui 284 000 associés et collaborateurs à travers le monde, dans plus de 152 pays. Grâce à ce réseau, dont le niveau d'intégration et l'ampleur internationale sont gages d'une même excellence partout dans le monde, EY renforce sa position de leader mondial de l'Audit, du Conseil, des Transactions, de la Fiscalité et du Droit. Notre expertise et la qualité de nos services contribuent à créer les conditions de la confiance dans l'économie et les marchés financiers. Nous faisons grandir des leaders afin, qu'ensemble, ils accompagnent les organisations vers une croissance pérenne. Et notre engagement envers nos équipes commence avec cette promesse : quel que soit votre parcours avec nous, l'expérience EY dure toute une vie.  Au sein du département FSO (Financial Services Office), plus de 1 000 collaborateurs en France combinent leurs expertises métiers, fonctionnelles et technologiques, afin de répondre efficacement aux besoins de nos clients en gestion d'actifs, banque ou assurance. Dans un contexte en perpétuel changement et hautement réglementé, nous apportons ainsi à nos clients des conseils pointus et de haut niveau pour les aider à gérer les incertitudes et les opportunités de ce secteur. EY poursuit sa stratégie et conforte sa position de leader dans l'audit des grands comptes en étant le numéro 1 sur le commissariat aux comptes du CAC 40 et du SBF 120.  Dans ce contexte, nous recrutons des Auditeurs Financiers débutants F/H - Secteurs Banque/Assurance - en CDI à compter de septembre 2023.  Vos missions  • Vous intervenez sur des missions de commissariat aux comptes ou sur des missions financières à forte valeur ajoutée (revue de business plan, revue des contrats à long terme, opérations de transactions…), • Vous mettez en œuvre notre méthodologie d'audit (analyse de l'environnement et de la stratégie de l'entreprise, évaluation des risques, revue du cadre du contrôle interne, audit des états financiers et revue qualitative de l'information financière …) et portez une attention particulière à la communication financière de ces groupes dans plusieurs référentiels (IFRS et US Gaap notamment), • Vous êtes amené.e à intervenir sur un ensemble de problématiques et d'enjeux financiers afin d'apporter à nos clients et à leurs interlocuteurs (actionnaires, banquiers…) l'assurance et la fiabilité nécessaires à leur progression.  Profil  • De formation supérieure bac+5 (écoles de commerce, d'ingénieurs ou université), vous êtes jeune diplômé (e) ou vous disposez d'une première année d'expérience en audit financier, vous maîtrisez l'anglais dans un environnement professionnel. • Doté.e d'un excellent sens relationnel, vous savez allier le sens de l'analyse et de la synthèse, rigueur et méthode. • Curieux.se, dynamique, autonome, vous faites preuve d'esprit d'équipe et de leadership. • Vous avez également déjà démontré un intérêt pour notre métier au travers de stages ou d'expériences professionnelles en cabinet d'audit ou en entreprise du secteur dans des services financiers, dans un contexte international.  Vivez l'expérience EY, rejoignez-nous.  Dans le cadre de sa politique Diversité, EY étudie, à compétences égales, toutes candidatures dont celles de personnes en situation de handicap."
https://www.jobteaser.com/fr/job-offers/10347204-michelin-business-developer-h-f-centre-val-de-loire,Business Developer (H/F) Centre-Val de Loire,Michelin,CDI ,Villeny (France) ,"Le Contexte Prenez en main un de nos secteurs de la région Centre-Val de Loire, et rejoignez une équipe d'environ 8 responsables commerciaux (Business Developers) accompagnés au quotidien par un Responsable des Ventes Régional. Vous avez de bonnes capacités relationnelles et l'envie de vous dépasser ? Vous êtes prêt à vous remettre en question et à monter en compétence dans le cadre d'un parcours ? Alors rejoignez-nous ! La Mission En charge d'un portefeuille clients de 10 à 15 M€, vous aurez la responsabilité de développer les ventes sur un territoire en France. Pour cela, vous imaginerez en collaboration avec vos collègues et votre responsable régional un plan d'action business. Pour remplir cet objectif, vous devrez entre autres : Gérer votre portefeuille de clients existants (Spécialistes du pneumatique, Centres Auto, Concessionnaires …) Vendre les produits et services du groupe Michelin Piloter les opportunités commerciales pour les convertir en ventes. Accompagner le lancement de nouvelles solutions. Supporter l'équipe marketing dans l'analyse de la performance des produits et services. Compétences requises De formation commerciale Bac+3 à Bac+5, vous devez avoir le goût du challenge et de la satisfaction client. Adaptabilité, résilience et remise en cause seront vos meilleurs atouts ! Le travail en équipe et l'intérêt des produits technologiques sont autant de points forts qui favoriseront votre intégration au sein du Groupe. Processus de recrutement Si votre CV est retenu, vous pourrez nous rejoindre après 2 étapes validantes : - Un entretien vidéo - Une journée complète de recrutement, pour pouvoir exprimer pleinement votre personnalité et nous montrer vos compétences. Un moment très apprécié des candidats et des candidates ! Après cette dernière étape, un retour détaillé vous sera fait sous 2 jours Rémunération et avantages Rémunération : de 40 000 € à 55 000 € Véhicule de fonction Intéressement, plan épargne entreprise, plan d'actionnariat, pneus d'essai … Formation continue Intégration et développement Vous intégrerez l'école de vente Michelin pour une durée de 3 mois à Clermont-Ferrand pour maîtriser notre offre produits pneumatiques/services ainsi que notre méthode de vente. Grâce à cette formation, vous prendrez en charge votre secteur sur la région Centre-Val de Loire dans les meilleures conditions possibles. Et nous vous proposons par la suite un véritable parcours de développement de vos compétences. Nous sommes prêts… et vous ? #LI-EB1 #Vente #Business Developer #Responsable commercial #Account manager #Centre-Val de Loire"
https://www.jobteaser.com/fr/job-offers/10347189-walters-people-charge-de-recrutement-stage-alternance-h-f,Chargé de recrutement STAGE/ALTERNANCE H/F,Walters People,Alternance 12 à 24 mois ,Paris (France) ,"Robert Waltersest la référence du recrutement spécialisé et du management de transition avec des bureaux dans 31 pays dont 4 en France. Créé à Londres en 1985, Robert Walters s’est imposé comme la référence mondiale du recrutement spécialisé. Depuis, le groupe s’est implanté dans 31 pays, est coté à la bourse de Londres et a été élu « Meilleur cabinet de recrutement international » en 2013, « Great place to work » depuis 2014 et récemment labelisé « HappyTrainees. » Dans le cadre de la croissance du cabinet, nos équipes recherchent un chargé de recrutement en alternance H/F mais également pour notre filiale du travail temporaire Walters People. VOTRE MISSION Basé au sein de notre cabinet parisien, vous intervenez comme business partner au sein de l’une de nos équipes (Finance, IT, Juridique, Immobilier, RH, Supply-Chain…) Vous prendrez en charge les missions suivantes : • Sourcer des candidats sur les CVthèques & réseaux sociaux professionnels • Mener la préqualification téléphonique des candidats en totale autonomie • Participer aux entretiens en binôme avec les consultants de votre équipe • Entretenir votre réseau de candidats et organiser des points d’équipe réguliers pour s’assurer du suivi des candidatures • Contribuer à l’administration et à la mise à jour de la base de données • Mener différentes tâches administratives inhérentes au quotidien de l’équipe (réalisation de reportings…). QUI ÊTES-VOUS ? De formation supérieure (Bac +4/5) en école de commerce ou équivalent universitaire, vous souhaitez intégrer un cabinet d’envergure internationale. Vous recherchez une expérience vous permettant de découvrir le recrutement au sein d’un environnement en forte croissance et à haute expertise. Dynamique, ambitieux, curieux, vous avez le goût du challenge et la persévérance nécessaire pour mener à bien vos tâches et aller au bout de chaque mission. Prise de poste en septembre (1 an ou 2 ans )"
https://www.jobteaser.com/fr/job-offers/10347183-mbda-responsable-integration-et-validation-systeme-h-f,Responsable intégration et validation système H/F,MBDA,CDI ,Le Plessis-Robinson (France) ,"MBDA est le seul groupe européen capable de concevoir et de produire des missiles et systèmes de missiles pour répondre à toute la gamme des besoins opérationnels présents et futurs des trois armées (terre, marine et air). Partenaire européen et acteur mondial, MBDA se positionne au cœur de la souveraineté de nos nations européennes et de leurs alliés en leur fournissant des capacités militaires décisives à des fins de sécurité nationale et d’autonomie stratégique. Les produits du Groupe sont en service dans plus de 90 forces armées dans le monde. Avec plus de 13 000 personnes travaillant ensemble en France, au Royaume-Uni, en Italie, en Allemagne et en Espagne, MBDA est l’exemple le plus abouti d’intégration industrielle réussie dans le secteur de la défense en Europe. Les compétences des collaborateurs couvrent tous les aspects de la conception, du développement, de la production, du support et des services des systèmes d’armes complexes.   Au sein de la Direction Ingénierie nous vous proposons de rejoindre le domaine de la conception de Systèmes d’Armes Navals, en charge du développement de systèmes et sous-systèmes dédiés à la mise en œuvre de munitions d’attaque de surface et de défense anti-aérienne à partir de plateformes telles que les bâtiments de surface, sous-marins, batteries côtières. Vous y prenez le rôle de responsable des validations fonctionnelles et du Dossier de Justification de la Définition (DJD) d’une installation de tir pour un contrat export majeur. Vous intervenez sur un domaine techniques varié (matériel, logiciel, réseau, Cyber sécurité …) dans le cadre d’un développement Agile. Grace à vos compétences, vous êtes amené à :  • Rédiger ou contribuer à la rédaction des documents (internes et/ou contractuels) relatifs aux activités de validation fonctionnelle et au DJD du Système. • Définir et planifier la stratégie de test des activités d’intégration et de validation fonctionnelle usine de l’installation de tir. • Définir et suivre des configurations applicables / réalisées, et identifier des limitations d’emploi de ces configurations. • Coordonner les revues d’entrée en validation fonctionnelle et assurer un support aux équipes d’essais. • Coordonner la planification des revues de DJD Système de l’installation de tir (en interne et avec le client) et de ses mises à jour. • En soutien au chef de projet, effectuer le reporting de l'avancement de l’activité, et préparer la tenue des jalons contractuels avec le client, incluant la participation à ces jalons, selon le besoin. Le poste est majoritairement national, avec des missions à prévoir à l'étranger   • Vous êtes ingénieur généraliste ou équivalent, avec une expérience professionnelle de 3 à 5 ans dans l’intégration validation d’un système. • Doté d'un bon esprit d'équipe et de synthèse, vous faites aussi preuve de proactivité, rigueur, d'organisation et d'autonomie. • La maitrise de l'outil Doors, Rhapsody ou Cappella est un plus. • Compte tenu de l’environnement international associé au poste, un bon niveau d'anglais est requis."
